id,text,is_offensive,target
0f4c361b-4883-4c20-a8cf-41de26804ff5,dışarıdan görünüşte eski yunan tapınakları yapıyı andıran anıtkabir çanakkale kurtuluş savaşı yıllarının hangi şartlar altında geçtiğini neler yaşandığını belgeleyen fotoğraf bulunmaktadır,0,OTHER
d171215b-8f2b-4f44-9b1b-fcfaa8ae6f6a,akllı zannediyorsun kendini,1,INSULT
4393d68d-992b-4269-a8d2-75abc6f7321a,ananın kafasında tavla kırarım,1,PROFANITY
4d6d6810-ff7f-4e26-a041-d0a840c801ee,ahşap süslemeli giriş kapısının solunda başka kitabe yer alır,0,OTHER
7e87ac25-775d-4377-95ed-8aa5a2b5a414,boş kaleye giden top olsan gol olmazsın,1,INSULT
8d0bd89b-dbc3-46e9-be36-28372f7dba4b,teneke taşaklı ibne,1,PROFANITY
99c076a5-cca7-4a54-b9bc-7baed2310df0,gavur tüfeği yatıyor,1,RACIST
4e75856e-279c-4285-925a-ef0cbd56f3d3,kız anadan öğrenir sofra düzmeyi er atadan öğrenir sıra gezmeyi,1,SEXIST
94751065-0605-484a-9a39-c09038544cb8,kürtçe şarkılar çalar burada,0,OTHER
1ab19da8-cd22-45c5-93e8-16a9f76708f2,senin yaptığını çorumlu bile yapmaz,1,INSULT
22c73bfb-3fce-47e1-a50d-1ff98d8480ab,ben partiden hic hoslanmadim,0,OTHER
e22d28b0-270a-474f-888a-1c38e896dd17,fikirleriniz saçma dikkate alınmaya değmez,1,INSULT
6aec3878-3257-4011-a868-9f0eff87afb9,konuda açılan görüşmeler ilerlemiştir,0,OTHER
04ef1100-b226-4cfe-81ae-2fc43f756665,evi ev eden avrat kadın yurdu şen eden devlet,1,SEXIST
bee3b35b-728e-45b4-a7fc-dcb6330d170c,senin arkadaşların öğretmenin yalakası resmen,1,INSULT
398af5f5-274e-4691-affd-45cad559084f,sende adam mısın sanıyorsun kendini,1,SEXIST
cc917707-ceaa-4fa9-bf21-ac2843817e15,kürde paşalık gelmiş kılıcı bileğinde sınamış,1,RACIST
6ccbccdd-d50b-4a69-a710-23c25be66035,bunlara ek olarak polis araçlarının binanın yanları çatısının iyi şekilde aydınlatılması ışıldaklarını binaya yöneltmeleri gerekir,0,OTHER
77f15464-a163-4c89-8c0a-54910ff74243,yahudiler araplarla aynı ırktan olup araplardan zeki olan millet,1,RACIST
0aa85045-b864-48e0-84b3-61338197c883,kız çocuğu yüktür,1,SEXIST
879d459a-62cd-4d7e-a6cc-46c7140ae516,gittikten hemen sonra seni görmeye geldi,0,OTHER
c4136eed-b6ba-4abf-b722-ba501a3a5764,tatarcık sineği,1,RACIST
5109ce04-1749-4c05-840e-f24ec5b65195,almanların ırkçılığı dünyada eşi benzeri görülmemiş türdendir,1,RACIST
0faf2652-76c8-4c6f-b9f4-b1e27e6cc34d,babanın şapkasının tereğini sikeyim,1,PROFANITY
b1afd5a6-e980-4f2c-a992-deec2c43645d,senin ben yaptığın işi sikiyim yavşak,1,PROFANITY
a0c0f2d5-ecfc-42aa-98e4-f8d6ae68053b,yaptiklarimizla ameleden farkimiz kalmadi,1,INSULT
c5a44627-2068-4c13-bf96-3f252af30783,kel kafalı kadın olur,1,SEXIST
5fe03a32-cf91-444d-b8c1-7b8f9f7bdda4,okullarımızda adları bile geçmeyen düşünürleri kitaptan öğreniyoruz,0,OTHER
3dca8618-440c-4de4-9515-e6c924f538c3,eğitim öğretimin amacı öğrencilerin yaratıcı yapıcı güçlerini geliştirmek özgün tasarımcı kimliği oluşturmalarına yardımcı olmaktır,0,OTHER
73859303-4fbf-4980-b6be-1406bca6fee8,babana travesti binsin,1,PROFANITY
d736809e-f4dd-46b2-a2ac-d64b350ec298,kolayca akmaz bilirsin erkeğin gözyaşları erkek ağlıyorsa asla sahte olmaz gözyaşları,1,SEXIST
71de166e-6d66-4862-b6e7-5a9f8c862d07,sikhler kavga orada,1,RACIST
4c2412a8-8a8c-4bda-8bb4-368f8d8ca87f,bebi seveni ben seviyorum diğerlerinin amına koyayım,1,PROFANITY
abf612a3-fff5-484b-93ee-e1c9489cde0d,yahudi komşu istemiyoruz,1,RACIST
75c203f8-9aa8-4759-bde7-8726adf76b5c,bizim net olarak gördüğümüz manzarayı pek hayvan bulanık görüyor,0,OTHER
45423fc2-f80b-4eea-8091-e17876a4e3ee,kızınızı allah in emri peygamberin kavli istemeye geldik denir,0,OTHER
255822ab-7882-4f2c-b459-aa77c5f3cd9c,ermenistan’dan kaçıp ukrayna’ya gelen ermenistan vatandaşı yağma suçu işlerken yakalanmış yaşadığı ülke değişse fıtratı değişmemiş,1,RACIST
15a8c5d4-bada-43fc-9987-3b7d712ca93d,siktiğimin antifrizi,1,PROFANITY
4d8d12a7-900b-4163-b2d1-7659f0b31b85,yavşak yavşak bakıyorsun,1,PROFANITY
05128822-1760-47bd-a4b2-d0b1ace5b79d,mehmet uzun partililerle sık araya gelerek sohbet programları konferanslar düzenlediklerini söyledi,0,OTHER
bee337f7-3488-49a7-87d2-606cee6ae631,anlatıp duruyor sana gerzek,1,INSULT
d8ffd3eb-4634-44bd-b852-1551da2e18b6,senin ananın amını yoğurtlayam yoğurtlayam sikem,1,PROFANITY
e2c0ba1d-b6a2-4938-80fe-4e5d212af97f,onun üç tane erkek kardeşi var,0,OTHER
7a8d03bd-6e46-45a7-8a32-79fce1d4bf70,dönme dolap gibisin duracağın belli değil,1,INSULT
b58d9d83-1859-4502-8fd7-b3f5584158ec,ailesi yeni köyden gelmiş olmalı,1,INSULT
f88015dc-e43d-4fbc-8fa5-52f989c38b7e,sefilsin kızım,1,INSULT
20b33fb9-7e74-499c-b2d6-adc4acb2796d,asfalt biti,1,INSULT
3b0d83ce-9bdc-4ecf-a84d-00047260bec8,bana öyle geliyor işin altından kahpelik çıkacak,1,SEXIST
53690467-5e00-4a30-b9b6-5f35f1851321,arap kızı camdan bakar öyle dikizleme,1,RACIST
577aac7d-52df-49e3-ac1a-4194db283cd5,şunu eklemeliyim uzun liste olarak başladı,0,OTHER
686522e5-0f05-490e-8878-e34b6d3b85b1,dandik adam,1,SEXIST
541b781f-1849-4485-82ce-62967f6a4b04,sülalene sokarım senin amcık,1,PROFANITY
f5abdc36-5947-4919-b643-eebe19f235c9,hırsız olmayan slovak görmedim,1,RACIST
ada8e518-d7aa-42c5-9245-71925187002a,bunların bariz özellikleri esas alınır örneğin nikotin,0,OTHER
7fc02220-013c-434a-9f57-014e4bdd4a59,suriyeliler burayı talan ettiler,1,RACIST
1225e55a-9033-418d-8f79-bf3812562ce4,çingeneden çoban olmaz yahudiden pehlivan,1,RACIST
524d108a-bbc5-45d7-9e87-cae20d8bb4e7,oğlunu seven hocaya kızını seven kocaya verir,1,SEXIST
ce72a58f-a48c-4c4b-b2ed-16c209819686,akıl alacağım son kişi sensin,1,INSULT
b236bb1f-18ea-4385-9876-de21ea3a8756,anladığınızın eserlerine yakın zamanda bütün dünya şahit olacaktır,0,OTHER
180343bd-3325-423b-a987-7a289991bc5f,uzaylılar görse seni insanlığa soykırım başlatırlar,1,INSULT
4a616e3a-ffb4-4536-8e3d-7ffd4cc02982,habere göre ebenin amını ankara gündeminde canlı canlı sikiyolarmış ben öyle duydum,1,PROFANITY
16a04885-3981-4b80-b607-f7ec8b05206d,hakem zenci futbolcuların itirazlarını dikkate almıyor,1,RACIST
e1423930-133a-412e-96cb-f1a06b124591,benim köpek senden akıllı,1,INSULT
3683961b-57ea-48e8-b3af-dae8043fe86a,karga sesin var,1,INSULT
914cc849-6b3b-42fa-8e76-10d805c510da,bardak beyaz şarap alabilir miyim,0,OTHER
c5218469-785b-49ad-979d-3a20f314d970,kasnak yuvarlandı elek oldu eski orospular melek oldu,1,PROFANITY
c1c60c13-0634-481e-ba14-5dac38d0327e,hangi bakanı kastettiğini açıkça söylemiyor,0,OTHER
a1c4a1a0-478c-46cb-aac8-c307602fac2f,türk erkekleri kıllı,1,RACIST
85db45e9-2009-48b1-b860-6cae1188535a,hanımcısın oğlum derse yapıyorsun,1,SEXIST
8219aa6d-9987-4977-a628-0e389a6b6cdf,kızların vücudu ekmek kapısıdır,1,SEXIST
c9f72fcb-00d1-41b9-ae32-709e1dfedcbd,seni doğduğun kiloya indirir anayın amına geri sokarım,1,PROFANITY
3a905c32-711e-4544-9962-c01735024842,gerçekten tür organizasyonlar ideal yer,0,OTHER
aa9c0e53-ae24-44fb-ad80-8a95f1d3142e,farklılık nereden kaynaklanıyor,0,OTHER
2b121d66-87a5-475e-8ff9-90d34ff93abb,ben olmasam kimse sana selam vermez,1,INSULT
4e6bda7d-6156-4b8e-bdf3-0175ee2ee922,öyle dil var sende karşındakini yılan zehirliyorsun,1,INSULT
e41172a3-929c-4b4c-a315-5099820498b0,unlu sarkici hadise hakkinda vergi odemek icin gayrimenkullerini ablasinin sirketi uzerine yaptigi iddialari vardi,0,OTHER
88c16c34-7c56-499f-9bab-da86c689252c,yılan zehirli değil,0,OTHER
ff82d17b-fd3d-4478-b0d1-c3c72727f6c3,kendi kendimize adam olamayız,0,OTHER
8db3d167-44d9-46ca-b6dd-661414070a86,kendininkini sevmiş,0,OTHER
466d2c05-daca-4e00-b090-4adc7b3b01e5,sikimden aşağıya kasımpaşa,1,PROFANITY
906c0f9a-38ed-4378-a34f-108a2cf624fc,senin götüne 300 splartalı girsin yetmezse pers ordusu girsin,1,PROFANITY
6851a7cc-561c-4d26-8bae-04efa4ca7084,arap suratıma bön bön bakıyorsun,1,RACIST
e89e055d-0ab6-4dfa-ac12-05718808a4bc,senin gibilere insan görünümlü şeytan diyoruz,1,INSULT
0f872ecc-d3fb-43c9-891c-a4de242fe6b2,kendi şarkılarımı söylemeye karar verdiğimde ayıldım böyle taklitle yürümez,0,OTHER
e71e93a8-b69e-4c38-a892-365f89f4c497,onlar versinler buna cevap,0,OTHER
63de6de1-72ed-413a-a018-b4d4d54a1011,sol seçerseniz resim sitenizde sol üst tarafta çıkacaktır,0,OTHER
dea7435d-aaff-4d86-ba80-883d9f512836,dean kadına ifadesiz suratla baktı,0,OTHER
dfdba5c1-fd3f-480b-b7ef-4e5911ee65d8,verdiğin mangıra bak soktuğun angıra bak,1,PROFANITY
319d7a2e-c3f1-4a49-bd94-dfac6854d4ac,at binicisini avrat sikicisini tanır,1,PROFANITY
96dc3578-e4e7-43c6-9260-f612cb9110a1,gavurlar ölsün,1,RACIST
fb4d936d-b2aa-4de6-9032-67c6e131a20b,kalıbının adamı olamadın gitti,1,SEXIST
078991fc-d873-4528-906f-7d0d34f810e5,beceriksiz seni,1,INSULT
09ad5637-71b6-40a6-9c1b-c3effabd2af7,suriyeliler zora gelemez,1,RACIST
5e6b0bbc-1310-4f8b-8b57-e9dfa8745011,anladım tamam teşekkür ederim,0,OTHER
e78e66ad-1970-43f2-9a74-1d7ce27e0da0,oldukça titiz çalışma yürüten ekipler yıkımın ardından bölgeyi temizleyerek çalışmayı kısa sürede tamamladı,0,OTHER
689da586-b4e7-497c-b322-024928a58e45,chp diğer partilerden ayıran temel fark var,0,OTHER
ddf180b1-6371-450a-8ff2-e1352a3061af,beyaz amerikalı seni,1,RACIST
c9965fb6-7c06-4151-a0be-d83e9b7ed278,yeni yasayı onaylıyor musunuz,0,OTHER
11bf47af-b6db-404d-ace1-16bb7d60fea1,buna çitleme hareketi denir,0,OTHER
380f61d7-5d11-4462-81a7-6b675e01724d,iyi kadının kocası cüppesinden bellidir,1,SEXIST
c366101a-5317-4ad0-b6f9-683dcb0126d6,sanssiz bedeviyi kutup ayisi sikermis,1,PROFANITY
764f9755-ce3f-481e-bde8-1334278140dd,uzun saç karılara benzemişsin,1,SEXIST
2aaa336e-b70e-40eb-af99-287646ac54fa,ermeniler insanlığın düşmanıdır,1,RACIST
c1415e32-18f0-4fd3-b371-f92e54b44af8,adam olmak yiğidin harcı değil,1,SEXIST
83b7c32e-f5fb-4b2e-b007-d32b82ee9faa,yapilanlara kars onlemini al erkekligine zarar gelmesin,1,SEXIST
01cab213-869d-4dea-8fc1-80fcd0df9924,zaten sınama yöntemlerindeki amaç kümelenmeyi önlemektir,0,OTHER
9425580f-78ce-4d76-a163-01932fa22ea3,kadınlar ancak kafa ütüler,1,SEXIST
e0ac95ee-26fc-4437-88f4-d592e49dc0a2,sana bi istavrozunu şaşırtırım kırk yıl kendine gelemezsin,1,RACIST
7f18f980-ac5a-4498-b74b-ca1e3ba5e124,karı lafı dinleyen kılıbıktır,1,SEXIST
d0740aef-c5cb-43dd-870f-c10dd4857bda,yalanlarına karnım tok bay yalancı,1,INSULT
a4d05847-a906-4fda-87dd-e2615e3fc1cb,kendi yaptıkları putlara tapıyorlar mantık,1,RACIST
ec03fe38-51ea-4b7f-9e92-c2a3114cba86,bana akıl vereceksenakıl verirken dikkat ette hepsini bana verme sende birşeyler kalsın,1,INSULT
93512609-db04-41f5-8758-1efbb284c016,yaptıkların erkekliğe sığmaz,1,SEXIST
088f6e7f-2bb1-4b54-ac70-6770d5fee8db,kiraz ananas kokteyli dekore edebilirsin,0,OTHER
1193e237-6744-4307-a29e-c2c1dcd9533c,bazıları organik yerel gıdaların pahalı olduğunu söylüyor peki gerçekten öyle mi,0,OTHER
afaf6bd0-afc4-4838-8543-36d63bb62528,türkler aklın sonradan geldi başına,1,RACIST
467c156e-1093-4f26-ae93-dd713269b012,aklı kıt olduğu dediklerimi anlamıyor,1,INSULT
339d77ed-885d-4296-8500-de5ef2f96565,kaplumbağa bile senden hızlı be kadın,1,SEXIST
841503d2-8849-4071-98da-82babc19d252,ermeni yahudi tohumlarını sonsuza gömeceğiz,1,RACIST
a4ff20bf-02b3-49b5-8569-d6d490ff1a8f,okuma direkt amele ol,1,INSULT
ce1ca6c2-4a2c-4a8a-b439-8160d2320eed,hiçbir zaman hak ettiğimiz değeri vermiyorlar,0,OTHER
5022c1db-680c-496b-b014-5366e4343c67,önemli parametrik unsurlar,0,OTHER
5f77c4ba-4d6f-45d3-9da1-e0dc96d9f36c,çocuğumun suriyeliyle muhatap olmasını istemiyorum,1,RACIST
ccc1d7bc-c722-4ac8-b02b-aeb9e3851e85,yıllarda eleştiri parlak yıllarını yaşadı,0,OTHER
f3324113-e40b-4dab-88d6-94a16cdcd568,kadınlar giydiğine dikkat edecek,1,SEXIST
b27d0370-be25-4c7b-ad8f-6e1c96a7c82a,kadın kocasının çarığı anasının sarığıdır,1,SEXIST
7696ad2e-3af9-4529-a1c1-0d73c391aba1,götünü siktiğimin iblisi bile küfürler yüzünden böyle günaha girmedi,1,PROFANITY
fb49cda8-23ef-4a16-8726-72a316d0dc40,saf salak,1,INSULT
d975b0d5-ff9f-49a5-96dd-46ab3155f8d7,sonra ben hain deyince kızıyorlar,0,OTHER
097dea7c-7e9a-4c92-b782-13ecb095cd56,döviz çeşitleri terimsel olarak farklılık gösterir,0,OTHER
01b6452f-3835-40a5-b274-aa5fc19f92ed,özellikle zor günler geçiren kulüplerimize destek olmalıdır olursa olsun,0,OTHER
87e3ccb3-2eb7-4c4d-a257-5f8f02a377e2,çürük çıktın sende,1,INSULT
6a8b4ba4-3afd-44a0-b204-faa2c191e5ac,bugünki amerika yerli halkı katleden katil devlettir,1,RACIST
6a07d30a-3c2a-4893-b5a6-5e09c6ac5740,açıklamalar test edilir gerekli kriterleri yukarı bakınız sağlamaları durumda bunlar kuram haline gelirler,0,OTHER
e37dd183-d562-4939-b101-8ff33fbbdc52,konuştuğun telefonun şebekesini sikeyim,1,PROFANITY
e90e0c02-af4f-4129-a571-ad95b85baeaa,adamakıllı denilir kadınakıllı denilmez,1,SEXIST
3769d1d6-e8c1-42bf-acb8-58f26dbeafc3,korkak olmaz erkek dediğin,1,SEXIST
384661ce-a345-4cb5-b0b2-5e9dd75d7c24,keşke doğmasaydın,1,INSULT
30b2da52-1dd0-4721-9521-40fb48a2bcc1,filmi izledikten sonra karı ağladı,1,SEXIST
9feb4089-77b0-40ff-bfca-ca3169ef1de3,özlediğim kızım oğlumdur,0,OTHER
7ab11d40-a97f-4355-a68c-58fad521493b,ben senin iki yüzlü olduğunu anlayamamışım,1,INSULT
bb9099d8-2422-4b3a-8d9a-dca6287b7934,şerefsizler var hayatta,1,INSULT
79caf10a-daf7-41a5-bd5a-8bb8c746508f,kadinin dudaklari ballidir kalpleri zehir doludur,1,SEXIST
53c941c9-c1eb-4320-bf7d-95e459a4b5e6,bamya pipi,1,PROFANITY
a73c9b2d-75a3-4b70-a25a-35b36c258650,çekik gözlü kızıllar çirkindir,1,RACIST
bc5d9681-11c9-4909-ab5a-ac2d73fa84fe,kolye takan adam olur,1,SEXIST
f058f694-a20c-4a3b-84d3-ccb135b11b54,osman zamanında devlet işlerinde etkinliği arttı,0,OTHER
51c6d8e5-570d-49c0-acba-f185eb39527a,sikmişim be aşkı yeter bana olmasın,1,PROFANITY
0ad2f47a-0ca4-44c2-bae2-92adf75f4be4,seni burada soyarım ağaca bağlarım ayaktan hayvan siktirtirim,1,PROFANITY
5b756195-40ca-45a6-8677-8b907a5e41d9,kimseyi nesneyi varlığı olguyu anlatmaya akla getirmeye yarayan kelimedir,0,OTHER
f09ac04d-aac4-45ef-95b5-5e9ba9fe7bfb,kadın dediğin doğurmalı,1,SEXIST
4075af69-9d36-4ac2-84d3-fdc09f708802,ayarın yok senin,1,INSULT
16f49ce3-c1cb-4718-aebb-adba8b7d5418,erkeğin imtihanı karısıdır,1,SEXIST
5e62ea49-607f-4734-a7c8-6e3a349edce5,kendine az güveni var,0,OTHER
2eddc0cd-6467-43c7-aacf-d2939663d2e2,sanayileşmek değildir türkiyede pil alırsınız radyonuza yerli malı iftihar edersiniz hafta kullanabilirsiniz,0,OTHER
fec1cdef-ef80-48ef-960a-24656dbdeb10,seni havaya atar düşene kadar yedi sülaleni sikerim,1,PROFANITY
4c32b034-367a-43d4-a99c-38690538392b,araçta boş bira şişeleri bulundu,0,OTHER
a1a5edc9-f79c-4710-979f-69f90b551fe9,sana oksijen veren ağacın yaprağını sikeyim ben,1,PROFANITY
9dbb48d2-7bed-44a5-950e-7f0aa83c0b86,ermeni gelini kırıtıyorsun,1,RACIST
ff574b58-a6e3-4105-b5b1-d75930d39b0b,sıskaçelimsiz olduğu herkesten dayak yiyordu,1,INSULT
5f15af17-0ca8-46b8-a3e2-1bd78a9d73cd,zenciler doğuştan kölelerdir,1,RACIST
96dd01cd-dd35-4624-a760-0d4bcff703b7,rum tohumu geliyor,1,RACIST
bf1d0b23-8366-43fd-a7f0-4cf515715a45,metro sisteminin temizliği erişilebilirliği şehri yaşanabilir kılıyor,0,OTHER
5d716123-ba9b-44bb-882b-d8325894a9f5,cingene evinde kaymak arasin,1,RACIST
6d06977e-ceeb-4162-8462-cb30bc5633dc,bugün müşteri var,0,OTHER
d3b91b6d-d782-4eac-9a30-815219cc0dc2,kız kısmısına güven olmaz,1,SEXIST
551fabf9-8528-44b6-abdd-6edf62a2c8fb,bok yiyenin oğlu,1,PROFANITY
29bf26d8-f3f9-402b-96ac-ff16e1305ae1,kancık şerefsiz,1,PROFANITY
45675159-00f3-49a8-8962-d16878ec554e,fırsatta durumunu gelişmeleri telefonla bildiriyor,0,OTHER
0551095a-f610-4903-bd51-4534116de13d,erkek yürüyorsun,1,SEXIST
f9a90e27-c9a0-4f8c-8bbf-c74d55060946,abd polisi zenci vatandaslara siddet uyguladi,1,RACIST
637b4694-6323-4a87-bc40-89067a3ba827,ananın ammına ağaç dikeyim gölgesinde serinliyeyim,1,PROFANITY
0b06f908-e043-4068-9eed-c65dd56fc6d8,bütün engellemelere rağmen büyüyen ekonomi var,0,OTHER
1dbe3556-edff-44e6-80b2-d215d5feeb26,alık salık sözler söylemeyi kes artık,1,INSULT
66d86185-7ebb-49a7-bd5b-bb7bded69aa0,seni yere atar tekmeler amını kırarım,1,PROFANITY
d67b98cd-8da1-448a-9ba1-90c31a9a1108,matematik dersi boyunca uyuyakaldım,0,OTHER
3fafbe1a-c727-40fe-9067-5689ad5322e9,referandum sonucundan parlamentonun feshi çıkarsa eylülde genel seçim yapılacak,0,OTHER
38dd45e0-ea73-4b5d-9a35-c4d0c4382a36,mülteciler yüzünden hayat zorlaştı,1,RACIST
d7bb1543-efa1-4315-bb4c-cb6d1d469f98,dünya dostum arap dünyası hariç,1,RACIST
91ce1afe-07cc-4814-b65c-355f4214bbea,satılmış pezevenkler,1,PROFANITY
ea224dcf-a0d4-46fa-be6e-0b556ff1a077,suriyeliler gün yerde olay çıkartıyorlar,1,RACIST
f5a50115-81ef-4ce7-8a3d-419a9129eaf8,asıl barbarlar avrupalılardır barbarı i̇ngilizlerdir,1,RACIST
8f280354-1c83-4df2-bb3b-870a9182969b,ülkemize işe yaramaz mülteci var doldu taştı,1,RACIST
7b3bdd40-5025-4e93-9043-b04c110be8ce,mikroskobik yaraklı göt,1,PROFANITY
1b15b521-99e6-48bf-a34c-43adfb6c4b75,avantaj zaten kendiliğinden yatırımcıları buraya davet ediyor,0,OTHER
954615cb-e86b-451d-b822-a9cb53590d4c,ananın amına telefon kablosu sokar pararel hattan bacını sikerim,1,PROFANITY
1ccd142b-81af-4850-8891-611b72bbbc49,oyun iki hakemle yönetilir,0,OTHER
0e6061ea-588c-4b30-8c67-b7091bdc097d,ezikmisin oğlum,1,INSULT
b12d15bb-a2ac-4c5b-a968-f164ad94a0e0,hava soğuktu dışarı çıktım,0,OTHER
df3f5360-8317-4821-b087-ca8da00b7f6d,saçı uzun aklı kısa,1,SEXIST
4a8b0b19-b01e-46bc-b6b3-04b2190d8c56,suriyeli çocuk benim çocuğum aynı kefeye koyamazsınız,1,RACIST
275b491f-cfa1-450f-9bef-ba761c1ba043,polen toplama sayma örnekleme teknikleri işlemlerle uğraşır,0,OTHER
4f8aa9b6-90e9-4837-ad04-b22c5c124fcf,ağzından çıkan kelimeler çöp,1,INSULT
ae909865-784d-4f3e-93e8-c2c97a6dba24,kızlık zarı ülkenin namusudur,1,SEXIST
93605878-bfe2-4e0c-b254-0692c4ff65ab,yılan sivri dili var,1,INSULT
36d266a7-cc3a-4e06-a2ac-70c6a4444690,kulağını siktiğimin karısı,1,PROFANITY
fe0f8c0c-63c9-4899-a0f9-cd61fa7e9255,bize yıl yeter,0,OTHER
e44aeb52-ab02-4813-9520-97db4726819d,bokla yapılan sidikle yıkılır,1,PROFANITY
df0b32df-b5c8-42d0-b5c4-9033e21655ce,köylü müsün,1,INSULT
151f4d4d-5ebe-48ad-9249-bb9b8ab0b63f,ölsen hoca imamlığı bırakır,1,INSULT
2aabb262-658d-44e3-8fa4-b6e7eb58a359,binası resmi kurumların dışındaydı,0,OTHER
3dff8f1b-9493-4eb0-9697-7c11f7f26a50,ananın amına ronaldo şut çeksin,1,PROFANITY
2f5feaa0-ed27-4145-96a0-53a7e708dad5,kız doğduğunda evin eşiği kırk gün ağlar,1,SEXIST
08719641-23bf-402c-af46-36b2e1674904,senin kadar berbat birini tanımadım hayatım boyunca,1,INSULT
7bc8968e-3f8c-4860-8802-853c36278063,kadın şeytana pabuç diker,1,SEXIST
8905a567-8989-417c-a7b6-1b2a7ac26885,görükle özel akademi kız yurdu ücretsiz servis imkanıyla sizleri yol ücreti ödemekten kurtarmaktadır,0,OTHER
797c5ae8-89e2-4388-875f-4a8f39c4a306,seni doğuracağıma taş doğursaydım,1,INSULT
2ff52bed-5ba9-4d67-9010-003c2ff4e23a,araplar kendini içinde bulunduğu ırkı üstün görüyolar,1,RACIST
33cbe622-2ed9-42db-ba58-dc6a1553ba22,açıklamanın tam metni aşağıdadır hekimler söz verdik ayrım gözetmeden insanın yaşamı bizim kutsaldır,0,OTHER
9e7f166b-e73e-4e13-85b5-8bf3a15423b1,fransızlar sömürgecidir,1,RACIST
cfc224fb-7412-4640-a352-7a26a61487c0,mülteciler vatandaşlarımızı rahatsız etmektedir,1,RACIST
d8a679bf-e4ce-49f1-a0c9-1a09556c0998,geliştirilen yazılımlar gizlilik bütünlük erişebilirlik şartlarına uygun olmalıdır,0,OTHER
bd1d9efd-40f3-4c21-a4f9-f11df0cd6ffb,senden iyilik beklenmez,1,INSULT
f831afe1-18da-4bcb-ba87-df72250f4a9f,moron fast food yemekten beyin hücrelerin ölmüş,1,INSULT
39f16a02-c98b-4da4-ab03-a7dde151e6f7,ye il kuru otu hayvanlar lezzetli besleyicidir,0,OTHER
ca64a60f-e40b-4a20-a202-16c7292edd0f,düzgün yürü orospunun evladı,1,PROFANITY
d71c204c-3d75-4832-80e5-b436d412364c,meral akşeneri gören yurttaş  kızım suriyeliler evimizdeki eşyamızı çalıyorlar,1,RACIST
ba542d00-d457-42d6-93a4-08e9daf9ec29,off zırlıyorsun kes,1,INSULT
384f6ad4-3bd9-488b-b84b-eee432f71b36,ben senin futbolcu yapanın amına koyayım diyen tirübündeki adamı hoşaf ettiler,1,PROFANITY
3e9dcee1-e30c-4811-9b37-08aa660809cd,git çay koyda kadınlığını görelim,1,SEXIST
3613ddd2-528e-4573-a3a2-745439feed66,oda yönetim kurulu başkanı ender şenol yaptığı konuşmada mesleki konularımıza girmeden önce ifade etmeliyim,0,OTHER
a90cb79d-011e-4d7b-bebb-e22cdfa875df,erkek yanaşıyosa kesin kadın kuyruk sallıyodur,1,SEXIST
ef391570-6e1d-40be-a860-724d6a1abe04,kız başına i̇stanbula gitmiş,1,SEXIST
69cb383e-83d7-4cd3-9509-d67b8bff91f3,dün almanların yahudilere yaptığını bugün faşist yahudiler müslüman filistin halkına yapmaktadır,1,RACIST
191a1e90-aa15-4077-a63f-aec297b14486,anasına bak kızını al demişler olsa adamız ağzımızın tadını biliriz,1,SEXIST
8dc8cf8c-f20d-44f0-9314-8205d12387ab,bunu beceremezsin,1,INSULT
6805f47a-e50e-4109-8cd1-1dde986e317b,kadın dövülüyorsa sorumlu kendisidir,1,SEXIST
49ab6134-5d50-4ffc-a7c1-5a9885982e49,her tamamen farklı,0,OTHER
21e5bf4d-1561-4252-870e-5fc4def1e6d7,adam adam ol,1,SEXIST
d8ecf5bc-f8d9-4614-b3e6-87756e356d92,senin aşağılık insanlar hakkında konuşmak istemiyorum,1,INSULT
261976a6-e88a-471d-b20d-9949ea3f916d,götün hoşaf olmuş,1,PROFANITY
efea18e8-6174-4e9c-993e-ea3b80c2db74,kızı köyde kucaklamayan kalmadı artık onunla evlenilmez,1,SEXIST
d73c28ac-0c97-4b92-aa1a-82daaf318cec,er kocarsa koç olur karı kocarsa olur,1,SEXIST
3c428dc0-2b20-4d2c-a89b-c2e9a9237ab0,kılıbı erkek kadın gibidir,1,SEXIST
47ba9596-e894-49c6-83a4-c6c99ba014b0,kız başına satte çıkıyorsun,1,SEXIST
59986205-ca11-4f48-a515-469e151632df,kendine gel kus beyinli,1,INSULT
1f8705d0-e780-48a8-9b9b-c570e37e6c4c,kadınler erkekleri yoldan çıkarır,1,SEXIST
32964a39-e717-478e-b27c-4a9e7751b438,bahçe deneyimli kaliteli takım kesinlikle yenilmez değil,0,OTHER
66e5db94-62cf-454f-9952-00e6205c79dc,koyun baktın,1,INSULT
d59d882f-8af2-4faf-ad68-e08440dc5f23,kılıbık yumuşak,1,INSULT
2e71ae40-3584-4b08-bf94-c46d9f5f6b27,bunu rahatlıkla aşmamız gerekir,0,OTHER
fd2f1c17-971c-4815-a297-69958a07055a,tarla olsan ekilmezsin arpa olsan biçilmezsin,1,INSULT
16a77aaf-f85f-49c0-9630-c6afaec34f00,angut adamın tekisin,1,INSULT
7a9f3189-5981-4d14-9abb-401c58ef0585,kış erken başlar genellikle ekim ayının ikinci yarısı kasım ayı başlarında ilk kar yağar,0,OTHER
1357dd91-f268-4563-bcb8-eab840882f49,kadın evi evlatları ilgilenmelidir,1,SEXIST
cbf4ba15-1968-42d1-b703-5fe852b14361,top musun,1,SEXIST
67baf0a9-69ca-41d8-b3c8-2ecedf1b09f8,hipertansiyonunuz olsaydı hissederdiniz,0,OTHER
c8a051a8-94ef-4b64-a48e-54d0fa4f8323,sizin köpeklerinizin burnu bile iyi koku alıyor bizimkilerden,0,OTHER
ba1125a1-3658-4752-bfe6-61d48012d5bc,götümün kenarı,1,PROFANITY
f2d08662-78e4-4359-a646-cda91fc515ed,erkek adam sakiz cignemez,1,SEXIST
723425ba-c7b4-4a51-9c19-81c25dcfe2ff,bugün vasatsın,1,INSULT
db7a1f93-bc2e-4814-83b8-cf646f317964,allah nüfus,0,OTHER
c50b43f5-6b5b-4a15-a3f0-913238f62442,referandum oylamaya günler kala sonuçlara dair araştırmalar sandıktan evet çıkacağını söylemeye başladı,0,OTHER
29641d38-70fc-4134-a853-441fa704ac01,çekiklerden hinlik beklenir,1,RACIST
fc78d1ef-2977-4e72-b4bd-0874dcae5721,dünyaya ot geldin ot gideceksin,1,INSULT
10e9f722-ba22-4ead-80c1-18a099507aaa,erkek dediğin kılıbıklık etmez,1,SEXIST
e8900c4a-0681-455e-b1f5-775a1af451b3,hayvan yemek yiyorsun,1,INSULT
df85fcb2-e3d4-4953-8eee-bda9457ef1e6,yeni araba istiyorum,0,OTHER
25631e63-bf7a-4def-8731-8b4b718f19dd,sende iyi yüzsüzlük,1,INSULT
2c185b3e-ec9e-4ab8-8c88-e097c02bd056,hu arkadaş kadınların eline araba vermeyeceksin,1,SEXIST
4e7300e6-6651-43e8-93f3-5d8ce526ea61,kızım adam gerçekten tam aptal buluyorsun onda anlamıyorum,1,INSULT
9f278df1-a6b0-4cb4-a808-4c1e865bbfe0,kadın kısmı okuyup olacak,1,SEXIST
a3d902af-5db3-46f0-89ea-1dd2dd5ed9dd,seni doğuranı tutup çekeni sikeyim,1,PROFANITY
75c87c2d-4767-4700-bcba-b3e1ff8bbc84,yola devam etmek zorundayız,0,OTHER
7ed8bd65-dc10-4e03-8116-760a40db848d,seni adam yerine koysunlar,1,SEXIST
032fd520-3b2f-4143-89ad-3fed0a860f63,buradan kendime durumdan vazife çıkarmak durumunda değilim,0,OTHER
35dde56d-5500-4970-b950-09a11bfec76a,ancak son derece sancılı süreç,0,OTHER
038e7c3d-c972-4905-9120-f2851ccabdb2,kendinden tiksindiriyorsun sana saygım kalmadı,1,INSULT
22868762-cd45-41b7-b0a7-6f02af474a3e,burnuna sıçayım,1,PROFANITY
e876f34e-bb00-4e25-ad08-d8094c4679b7,kızlar ofsayttan anlar,1,SEXIST
865a5913-cddb-4050-afb6-e15f0973d775,süre sonra iyileştim,0,OTHER
8d377a8d-b7f6-4ef1-9cd6-3ef3b704be3a,ebenin ammına ağaç dikeyim gölgesinde serinliyeyim,1,PROFANITY
4a5df52d-2e00-4f37-8ecb-7500a21df020,erkek saç kestirilir mi kızım sıfıra vurdursaydın iyiydi,1,SEXIST
dbe0b316-4700-4eba-9308-9540c7c56310,kadın yeri geldi mi seveceksin yeri geldi mi döveceksin,1,SEXIST
5e297e7a-f958-46bb-8acd-c619de6b2a2a,mehmet film dizi film çekimlerine katılıyor,0,OTHER
b89b6a01-b989-4335-9dc8-e2eaa91284f6,kadar andavallısın,1,INSULT
88616bb8-64e3-4443-892d-8fd5a1e9dbf8,fiyat teklifi hazırlamak prosedürlerin açık olması gerekir,0,OTHER
07cd3a21-f963-4543-a030-5b18939be12a,ananın karnındayken kafana ecnebi yarrağı değmiş,1,PROFANITY
b00c3d55-dcd8-45ab-8420-f4c669fc4d61,kadin degil misiniz hepiniz aynisiniz,1,SEXIST
d41f72ec-088e-4a51-9299-0b8a1d0fa2c7,kadar zevksiz olmayı beceriyorsun,1,INSULT
8fb1b0d3-bd72-4c57-a773-70c877311e2f,yahudiler dünyayı ellerinde oynatıyorlar,1,RACIST
3e69d8e8-f04b-4a42-ae34-be52ed85ed45,nankör köpekler bi̇le durdular ülkemi̇zde defolup gi̇tsi̇nler,1,RACIST
