id,text,is_offensive,target
e1a5452f-0d51-48b0-80e9-f8d65be05c1a,yetim cocuklara yanlarinda getirdikleri cesitli hediyeler bayram harcligi verdi,0,OTHER
605b9fa5-ef12-47bc-acb0-8cd9179c0c74,timsah gözyaşlarına sefer kanmam,1,INSULT
c87c6af3-c794-4839-8fad-6df19a2de811,gri tersine kadercidir,0,OTHER
a1dcbe6f-dd9a-4a90-a4ad-63baa541cbf7,mini etek giyecek benim yanımda giyin,1,SEXIST
84922ad3-4464-4d23-b7d1-68d1f3dea122,aptal mıyım ben sana güveneyim,1,INSULT
5b9aa8c9-40b7-4e6e-9b19-106c6f7cfcfb,muslumanlar olabilirsek biiznillahi teâlâ bizi kimse yikamaz,1,RACIST
94effc3c-9307-40cf-8383-a84933195bac,alevilerin yaptigi yemek yenmez,1,RACIST
f870ffbb-3f4f-4c5c-9f83-018fa472da12,babamın kötü dölü,1,PROFANITY
4faa26f3-a023-4fe2-915c-bf787e364f98,taktirde projeye sağlanan demirbaş cihazlar geri alınır,0,OTHER
2a618a34-f5af-41ff-a90c-b22beeda32ce,onlar hatalıysa olur,0,OTHER
ae314d15-fc53-4b37-a901-65b31b4555da,mecburuz ekmek parası diyor,0,OTHER
9ccc5604-a3df-4cf1-93c9-9cc4f1cb2e9e,nah yapmadın yarrağım,1,PROFANITY
6b0f0d86-20e1-4894-b561-ce151763a05c,gavurlar yaptıysa diyecek lafım yok,1,RACIST
93cfd365-d53a-4d83-aee2-1a1199e4d8ee,ağzını sikeyim muşmula suratlı göt,1,PROFANITY
0e53e0bc-ea18-4c0c-8848-22a84a123a8b,aşağıdaki listede fazla arapça yıldız isimleri anlamları bulunur,0,OTHER
8f0b44d7-5640-47ef-b692-f81664a5f07e,hop dakika kulağa hoş geliyor kafamda deli sorular var,0,OTHER
f8e34055-28db-4561-ae23-90ebc6c9ac3f,laz kürtün deniz görmüş halidir,1,RACIST
89b5c0ff-1cc6-4735-b17d-2670ed6cb8e0,sizofren kafali seni,1,INSULT
576aea76-4465-4234-8f1c-9dab4640ab77,karpuz götünü sikerler,1,PROFANITY
33837673-bf3e-421a-b44a-69d98afe6f1e,sikim hıyar desem tuzla koşarsın,1,PROFANITY
859b9df8-7776-4d93-bdc2-fffffb6f3685,özürlü avukat olmuş,1,INSULT
0421312a-bfa8-4f06-8959-4e1cff09fceb,sağlık durumları gayet iyi,0,OTHER
64ca35c7-40cd-445a-9573-4e2433c6951f,pilotun numarasıyla birlikte sallanmadan gösterilirse pilot tür içerisinde kendi pistine gidip durması gerekir,0,OTHER
7494992e-a40f-4350-81d3-2b454d49a114,kızlar arabalarla oynamaz,1,SEXIST
ea3ffc0a-9ce7-443e-9099-6e6a6df69394,ancak talepte artış oldu,0,OTHER
fd3f9c7d-4f65-469f-b960-82a2661b54c4,bütün işletme sahiplerine misafirperverlikleri teşekkür ederiz,0,OTHER
76e19616-a2bf-46a1-8926-16633d42de78,kadınlar erkekler kadar hiçbir alanda güçlü olamazlar,1,SEXIST
5ff4d7bc-33f4-4298-a2fd-e41db2b338f4,ağzı olan konuşmasın sikerler ağzı,1,PROFANITY
81885f2b-ae57-4c9b-a76d-039780b6f618,bundan sonraki müzakerelerin sonuçları hiçbir söyleyemeyiz,0,OTHER
cc68f515-c2db-4034-8513-38901bc2ff96,piçin bebesinden ne hayır gelir,1,PROFANITY
ba93a96d-fbe5-4b2d-94a6-c3b0030b9d63,kadınlar erkeklere göre detaycıdırlar,1,SEXIST
26185097-6186-4dc0-b273-a1ec0ca8aa49,sınıfımızda türk var,1,RACIST
9aae51ba-ddec-4717-bdd3-9eb57993212d,erkeğin günahı eşikte kalır kadınınki içeri girer,1,SEXIST
7cda932f-0e60-4f5e-882d-6c5968b9b82e,deprem konusunda eğilmemiz kaç olay yaşamamız gerekiyor,1,OTHER
5d58b130-3cdb-4d0f-8818-84d4f76cb58a,kimsenin olmayan aynı zamanda herkesin olan şebeke,0,OTHER
7c56246c-b181-416d-9aa7-6ce9fd140399,aşağıda yer aldığı filmlerin listesi yer almaktadır,0,OTHER
a0759497-3877-48c6-a013-f8f3233f8f37,kadın evinde oturup evle ilgilenmeli evliyse çocuklarının annesi olmalı,1,SEXIST
c9b68844-21a5-489b-9164-70adf29a9858,ananı ranzanın üstüne koyar alttan sikerim,1,PROFANITY
43e7b856-61dd-46e7-bce9-27bab6a8349f,alisveris yapsan kasiyer istifa eder,1,INSULT
28070610-4388-4f90-900e-d2039d5b03c2,sarışın aptal,1,INSULT
5c07dc17-84d2-4d3a-aea0-3cb2c652409a,kadın asker olmaz,1,SEXIST
443e9e9b-84fa-41ef-b8a0-3cc163928894,seni zincire vursalar kilidyle oynaşırsın öyle orospusun,1,PROFANITY
396b558e-9d78-4805-a44a-4681ba4426bb,bakıyorsun dik dik ananı siktik,1,PROFANITY
11273890-b70d-4842-8919-be13c6432bd8,erkeklerin duygularını göstermesi zayıflık göstergesidir,1,SEXIST
07ea1346-b97c-4df5-8815-294535bef067,acemi nalbant kendini gavur eşşeğinde dener,1,RACIST
0a4d8295-12b7-4a25-8ae3-6e7f2d247d13,çingene den çoban olmaz yahudiden pehlivan,1,RACIST
64df9c54-f076-4c4c-b26b-f35c161f3acf,kadın malı kapı mandalı,1,SEXIST
d84208f2-dfaa-4cc5-8370-4043cdcfe815,tesadufler uzerine kurulmus sinama yanilmaya dayanan sistemli dusunceyle elde edilmemis sonuclari pek sevmezdi,0,OTHER
ca160731-9bf8-4130-a555-34e772ef81b8,avrat malı kapı mandalı,1,SEXIST
802da217-0901-455a-91b6-a8cca507c496,akşam sabah inek çalışıyordu,1,INSULT
c0f560e7-5301-4363-812f-acf83fc42f8f,çingene ata binmiş bey oldum sanmış,1,RACIST
78ac3480-6784-479a-b7d1-c34ddf6ae8f6,omuriliğini sikiyim,1,PROFANITY
a476f028-73ee-4e89-a407-589e3a510889,davetimize icabet ederek bizi onurlandırdığınız teşekkür ediyorum,0,OTHER
828d91a6-144d-4d90-8bc2-893f612d8315,senin götünün astarını sikerler,1,PROFANITY
ff85a810-10e7-4e56-94c0-326ccc2cf77e,kadının eli kaşık sapında kararır,1,SEXIST
b165085e-4bc4-4cc2-b5d6-37da8b843ed0,otur kocana hizmet et,1,SEXIST
45c51a04-4dd1-4bdf-b8bf-39124382b837,verdin oldu fahişe,1,PROFANITY
6bee9a2c-83dd-490a-81d0-f2ce49b75395,kadınlar daha ince düşünür,1,SEXIST
58b47c91-8ca1-4a2f-b908-dc022d467a03,çingene parasıyla doluydu cüzdanı,1,RACIST
0e35b01b-4afa-4ad7-896c-c0fc4da2d369,armudun hamı topalın amı,1,PROFANITY
b2800af8-b386-4151-b642-cc9381d229a8,beyaz tenli insanlar güneşte yanar,0,OTHER
b06c0909-ef18-4e36-8b28-16504c5dab97,ayrıca kanuni ipoteğin tescili süre sınırlıdır süre geçtikten sonra kanuni ipoteğin tescili istenemez,0,OTHER
5dac2cc7-f391-4d6f-8062-9a0eed0e57b6,top götlü yavşak ortalıkta geziyor,1,PROFANITY
d6e91a32-eb85-44c1-be2b-7a4082a67429,sevdiğin tahıl nedir,0,OTHER
feced7ee-380d-4c13-a969-dd899e512676,oda cifit carsisi olmus,1,RACIST
495f7932-93e4-4586-b03e-6f5cd095d4d7,mürettebatta kadının işi var,1,SEXIST
5effbfbb-357a-4a53-84bf-38376912de8b,tom iyi öğrencidir,0,OTHER
fbcaffd4-73d8-4fbf-9a1d-5ae82bb96b1d,kadın erkek eşitsizliği,1,SEXIST
b7d25ccb-900a-4b3b-a567-72fbb76b8079,sikini keser eline veririm akıllı ol,1,PROFANITY
f42489cd-3e86-4fc8-98b3-358b0514d4ff,bana yaptığın ibneliği unutmam,1,PROFANITY
9aac948d-76dd-4c6a-8a8a-0c4c670cb4d6,zaten top olmuşsun düşsen duramazsın,1,INSULT
4cdf49a1-a11d-499d-8b85-02057278feac,laz uşağı mısın,1,RACIST
5eebc98c-11f8-4fd3-ba58-5a71f89fd1c2,suriyeliler hataya gelen yardım mallarını yağmalıyor hataylıların elinden zorla alıyor,1,RACIST
6cf63109-d4fb-4445-8721-4a3a627b5f29,bunca yıl körü siksen gözü açılırdı,1,PROFANITY
c70dacea-ac53-42fa-9834-44dcda22aaba,yahudi adamdan dost olmaz,1,RACIST
44812810-8bcd-4dd8-9c83-48e49c170db7,haysiyetini siktiminin,1,PROFANITY
9a4ce7a8-64fe-4f8c-994c-8e9f3e5c4946,mücadele etmeye devam ediyor,0,OTHER
fed4d9df-6788-47a3-991f-c3c2ace4530b,çingeneye benzemişsin,1,RACIST
a6cffa7e-7773-4e74-949b-f8205db5a56d,sonra düşman gelmiş memleketinize,0,OTHER
b56312a3-cd90-45db-8412-3b9314e386a0,sistemin etkin olarak çalışması açısından düzenlemeler önem arz etmektedir,0,OTHER
a43db0e7-e18f-4d0d-b828-bade7de27acf,fakirin karnı doyunca siki kalkar,1,PROFANITY
bb60b90c-d8d8-442a-994c-153ec4c77b7d,kadınlar verimli çalışamaz,1,SEXIST
0ceccd2a-ab06-4c21-9de1-a94a0d9fd076,lan sibop bak şuraya,1,INSULT
1b343c00-bbfa-45d9-b542-439fb780e8ba,kadın dediğin iffetli olacak,1,SEXIST
5f8e4921-d3a8-4851-b973-d4e6a936de17,amina kodumun sikik hayati,1,PROFANITY
c84475c8-f292-48ca-a45a-8b2192483aa8,avrat düşman olmaz yüzü güler bildirmez,1,SEXIST
873f8a30-3808-4f40-833a-acfd7101b944,tarafta kırk yıllık arkadaşlarım öte yanda kederli kadın,0,OTHER
c2bbe117-82b1-4abb-aa35-d96f7bbda964,kenarları kapatılarak düzgün rulo şekli verilir,0,OTHER
35237471-8b64-4a22-8481-cfd8a411041c,derse sadece mi çalışıyorsunuz,0,OTHER
ba95f896-5650-4c2c-a895-c2426edfc105,ruslar ahlaksizdir,1,RACIST
dad1709f-12fe-45da-be03-564dfd12b91a,git günahlarında yan,1,INSULT
bd68185d-9e2a-4f11-904b-66a5f4d0bfe0,genç kızsın misafire hizmet etmelisin,1,SEXIST
1f263da2-daa6-4b68-a00f-a9bcb5c6e6c7,hayatimda senin cikarci adam gormedim,1,INSULT
51cb7251-d058-4f70-aa2a-5ec4e029c7fd,ermenileri kimse sevmez,1,RACIST
2d8bd2ce-378b-4632-b3a2-01f563562303,yüzündeki beni sikeyim,1,PROFANITY
ee18cb63-ff6e-478e-82c9-9a41fa94bc18,sözüne inancım kalmadı şimdi siktirol git,1,PROFANITY
8e3d5c08-ad3f-453d-813d-7abaa949191f,tom yerel bara takılır,0,OTHER
f9f01c17-6a09-4917-bcf8-6b486d2a8dea,millet memleketin gerçekten minnet teşekkürüne hak kazanmıştır,0,OTHER
d5492da6-2e0a-4b61-9df4-6c884d772642,kötü niyetin adeta yüzüne yansımış üzgünüm dostum,1,INSULT
689a15b5-2598-4874-9813-0ff27dcdb559,sutu bozuk orospu,1,PROFANITY
4222c1ae-7b93-4990-a067-ccd0e40ac59c,kara fatma,1,INSULT
b8fc5c20-c403-4afe-a351-a5f74c13970e,ayrı geçen altı yıldan sonra iki kardeşin ortak hiçbir noktası kalmamıştır,0,OTHER
d081c4fb-f2f5-49ac-8153-7d00626f33f7,erkek aldatıyosa kesin kadınındandır,1,SEXIST
f3f9e6cb-337b-4ccb-acb7-fdb39bfcfe10,kanını taşıyandan başkasına güvenme,1,RACIST
e8984e4f-5fff-4b71-b778-3fae5385373f,ah bilsen yılandır,1,INSULT
99552954-2f56-4aee-957a-20d53de92b57,yalnız kadın hayatını sürdüremez,1,SEXIST
b9fb9592-5d03-4146-955a-d5eaff6f8cb9,tipsizligi ortamlarda cok durmaz,1,INSULT
87ccba69-c3a5-4942-8485-7f6754006341,nedenle pek ülke devamlılığı kritik bir husustur,0,OTHER
d541ab39-a2c8-4f57-a7c5-f2bdbda2f6b1,dünyanın orospusu olmuş hala ben namusluyum der,1,PROFANITY
95063d2a-ce7b-4f9b-8804-a32e6821897a,küçük bi insansın ancak kendi dünyanda koca bi devsin tebrik ederim seni,1,INSULT
7e156ed0-16b5-4117-83d8-56d74090b1ae,amına antifiriz dökerim,1,PROFANITY
77f4b146-d5d5-4dd4-8faa-cbc8c9751822,ermeni gelini,1,RACIST
d46466bf-74ab-4e70-beaf-d9fe89163e34,senin bana yaptığını yunan gavuru yapmazdı,1,RACIST
f40c38cc-73eb-4895-b019-bee91409d480,sana oksijen veren ağacın yaprağını yemeyen tirtilin haysiyetini cibileyitini sikeyim,1,PROFANITY
6401c7aa-c45c-48f7-baf4-3891d3d00c32,kedigiller familyasindansin aslan degil budala bi kedisin,1,INSULT
d1f82da4-1e92-4800-81c7-4e201e7c09b9,güzel sözler var mısın,0,OTHER
5b7aa0b9-ad17-46f7-9265-2a9e6bb5330b,öğretmenlik kadın mesleğidir,1,SEXIST
4537748f-893f-40f8-8f7f-593c7b01b1dc,diş ipinle örgü yapılır,1,INSULT
0861833c-a242-46ab-bbbd-0aee151ca9a9,ananın amuna çin ordusu manevra yapsın,1,PROFANITY
f9fb45ca-11de-4a34-90c1-e478e2446e93,ermeniler sevilmez,1,RACIST
491c1640-484e-444c-b200-f74a3d2d487c,boktan şeyin altındaki sikik tornavidanın sıçtığımın ucunu versene,1,PROFANITY
b72e39e7-e107-426f-82bc-02dbb5f43fa9,aşırı tepki veriyorsun kadar önemli değil,1,INSULT
c7315a9a-65b4-416e-91c8-4e6d67f60b75,ağzını burnunu dağıtırım piçin çocuğu,1,PROFANITY
469edaa9-2b19-45fd-af5f-fc755c0d2b7b,ölsen fındık fıstık yer keyfime bakarım,1,INSULT
9fc01b2f-635d-45be-b4b6-28627b650f6e,pörtlek gözlerini belertme,1,INSULT
43f0fe3d-0040-4214-a675-9fe3068b4117,taşşağını kopardığımın pezevengi,1,PROFANITY
d8f6ba0c-273c-4297-89da-2b4f92bf44da,sana kac kere dedim cahil cuhela takimina laf anlatma,1,INSULT
818754a7-cbf5-466d-95fd-b58f4178cfcc,belgede bulunmayan bilgiler eklenmemelidir,0,OTHER
44850c4e-affb-462e-9476-cecd4aa8b216,fakat hasis böyle ildir,0,OTHER
54050b91-0e72-4e31-99ad-71dadc119103,eğitim öğrencilere saygıyla başlar,0,OTHER
13ad60a3-db31-4601-a308-e08ad952c713,bugün pazar ermeniler azar,1,RACIST
27f3292a-0e64-48f8-a8d8-7ba908d2beb4,senin ananı sikerim baban ayakta alkışlar,1,PROFANITY
837dbee0-497d-4fb8-adc8-8a210a190955,museviler kendi dinlerinden başkasına saygı duymuyorlar saygısızlık diz boyu,1,RACIST
1bb5fd60-d88a-4d31-a176-a97fc4f97541,kimse suriyelileri istemiyor,1,RACIST
93ad5ad9-d6b2-45e5-90bc-d937b793d5e6,öküzler intihar etmez,0,OTHER
2c7b494f-5153-431f-8ec1-f4831fafc49e,kürtlerden adam çıkmaz,1,RACIST
7c62abae-a24b-41e1-96e7-4540c3ef5d0f,gavur gavurluğundan geri durmaz,1,RACIST
458b373d-f22e-4676-b001-44efeb6f7c8b,kızın var sızın var,1,SEXIST
89018c60-b72d-4a1f-9eb6-bcaa7d141295,rusun lafına inandın,1,RACIST
df5dbe81-b7c8-4340-839d-7a997037cfb3,ekip başkanı raporun tamamının ilk taslağını kontrol etmekle yükümlüdür,0,OTHER
f49d47c9-2421-43e7-a477-3b2b7dd7dd3f,hayat merdivenlerini çıkarken insanlara iyi davranalım,0,OTHER
ed51fc19-d62a-4c51-bf9b-362cdc9578c8,iyi tatlar aromalar üretebiliriz,0,OTHER
8d80e446-fa78-433a-8740-13fb5cf558c0,sülaleyin amına koyum,1,PROFANITY
883d2d0e-1a40-418a-9745-02f1886b4fbc,amın düdüğü,1,PROFANITY
4a7f2d17-2eeb-4302-a2a9-cd4a8883c41d,karşılaşmanın ardından iki takım taraftarları stat dışında kapıştı kavgayı polis güçlükle önledi,0,OTHER
166eb286-26ba-4549-b7cb-e3924eee5c86,ben ölecek hissettim,0,OTHER
6d15440d-6655-4c34-a28d-c799b1ea3651,ankaranın dikmeni gidersem sik beni,1,PROFANITY
d937328e-0396-41ae-a763-127a5248e970,erkek aldatsa kadınlar elinin kiridir,1,SEXIST
0a626d40-bb68-46b0-9392-f7ff76ad616e,ay satışlar düşük,0,OTHER
d943e98f-49a5-4983-879c-8ecfffc9cd96,bugün i̇spanyolların elleri kan revan içindedir pek milletin kanı bulaşmıştır ellerine,1,RACIST
fc902ab1-6190-4431-a62b-5990338f82bf,tarafsızlıkları kanıtlandığı zaman,0,OTHER
6766e21b-21c7-498e-86ac-d4dfb7a6db98,kadınların kafa ütülemekten başka marifeti var,1,SEXIST
b22664d9-1780-4652-9886-1e034a7c0d94,iyi kotu demenizle ben iyi kotu olmak istemedim,0,OTHER
d453b7d4-3b30-4091-a820-e85470bc06a9,ülkece zor zamanlar yaşarken bizi yağmalayan mültecileri şehirlerimizde görmek istemiyoruz,1,RACIST
bab427ce-6f19-4c49-8f3f-61d4cfb2b773,acemi nalbant kendini gavur eşeğinde dener,1,RACIST
f8a367f2-f9dc-4022-b0aa-0b18f1fa70e6,omurgalı hayvanlar genel tüketici olma eğilimindedirler nadiren iyi biyolojik mücadele etmeni olurlar,0,OTHER
57e97990-d023-4835-9138-7f2a9be689e1,kadar çalışmayla birinci olacaksın,1,INSULT
c924409a-a3fa-464d-9649-50d2afbe1404,senin renk olduğunu çözemedim,1,INSULT
729e56d2-f98c-478c-93c2-dce0c909649a,zenciler kaslısın,0,OTHER
a80bc1b1-89c9-40e9-8825-a2f7f7c197e1,yüzüne bakılacak son insansın,1,INSULT
b528ef01-a189-4788-b40a-b1bca11e16ef,simdi anani laciverte boyadim,1,PROFANITY
279d2494-096c-44d7-b1a6-0036f5f290e8,sizin başarınızın sırrı nedir,0,OTHER
975a37ef-c294-40f7-908a-f45e52960d1f,çağrılmayan misafir yaşlı kadından kötüdür,1,SEXIST
5ecc3707-5da6-4941-85ab-e9dd44725c34,mahalle ağızlı,1,INSULT
b3a615ea-60ed-49ae-806e-d3910317f3fa,erkektir aldatır,1,SEXIST
8cb0c62b-ecff-4748-bbc1-a0ebb94fc072,amını yurdunu yerle ettiğim,1,PROFANITY
357d420f-38a3-4175-9b0c-32a87ceb8db1,bağlamda köprülerin temelini atmak bunun sürekliliğini sağlamak çok mühimdir,0,OTHER
bc3aa746-42fd-49a6-a408-b39ad60cdd37,burada çingene istemiyoruz,1,RACIST
4a75d005-e74d-405b-89a6-8bd0ea87915a,buna ek olarak polonyada almanyada çanların altında parça ringa balığı yemelisiniz,0,OTHER
44ad76cc-18bf-49c0-81af-981227a503b1,eşi tarafından öldürme kastıyla yaralandı,0,OTHER
01aa0437-b3db-43bc-abca-69499673f5fe,orospunun sıçtığı,1,PROFANITY
bc8938f0-0cf8-47f0-abb2-e3e179ed426b,çingene kıvırtma,1,RACIST
1fe86a4e-69a5-4536-9d5c-73f7c0b25ce6,doğanın dengesi bozulunca karşılaşacağı felaketleri zaman görebilecek,0,OTHER
7a2787e4-2968-4327-bed4-4e0922147805,yaygın ortaya çıkan belirti kişinin şeylerin ters gittiğini kabul etmemesidir,0,OTHER
7cda92ba-7545-4200-893f-5e2eacdb2747,tıknaz dediğini bilmeyen  ağzı kokan ayının tekisin,1,INSULT
03b7bf3a-7e5c-4bd9-a427-88a6b0481410,dağdan inmiş ayı davranma,1,INSULT
e9d7b221-4f37-4950-a5d5-02ff7eeeedfc,hepimiz yalaka çocuğa imreniyorduk,1,INSULT
be1f1aac-7356-44e8-a1a6-f8bde565a36d,kadar iğrenç müzik zevkin var,1,INSULT
694b0710-1bc7-40b0-bab5-5d2468cde5b9,pis zenciler,1,RACIST
0baf7e27-9a48-4323-a98b-cefc6af09061,evin pis,1,INSULT
34516e3e-fbc0-44ec-973d-935d4a56a69f,akılsız salak,1,INSULT
f9703fc4-a865-4d22-9e2e-2c489aa9dbbd,lağımdan çıktın koku böyle,1,INSULT
d7a16136-41a8-43ff-b493-2b01d3bfdfce,dağdan inme,1,INSULT
02f5b687-51ea-4b2c-963e-9f79d290348d,sorular bilgisayar bilimi felsefesinde tartışma konusu olan takım sorular vardır,0,OTHER
11fb98d6-b75e-449e-94d8-96dcfb9b19d2,eşeğe kürt demişler iki hafta saman yememiş hesabı aç kalacaksın iki hafta,1,RACIST
9484ad90-f987-4445-84cf-0c8d360d4e59,ayrica federal mahkeme mi uluslararasi adalet divani mi davaya bakmali sorusuna cevap bulunmali,0,OTHER
8917869a-3a4e-41e7-8891-f32b33e07b51,senin gelmişi geçmişini ters çevirir üstünde seni sikerim,1,PROFANITY
3ec5345c-c356-4ae9-9687-185b7fa2c370,vasat insan,1,INSULT
b2793cc1-b6a9-46c3-90c3-18b305bdcef4,hayvan olsan hayvansever kalmaz,1,INSULT
145c3f3d-3380-4222-bc42-8cf04f5d5025,şeyler siktir edilesi,1,PROFANITY
fe59016d-be14-482d-abb5-0bf6d0f43b24,çinliler pis boğaz,1,RACIST
8c2882b4-3209-4f6c-9fbb-39126af368b1,müslümanların gerici olduğunu gösteriyor,1,RACIST
fffe0f22-84f7-40e8-919c-8500e6ea6ebb,ermeni gelini gıbı kırıtma,1,RACIST
bf3f9eb2-d606-48d3-9378-d32494c11394,uluslararası artvin kültür turizm yöresel ürünler tanıtım fuarıyla şehrin marka değerinin yükseltilerek kentin türkiye dünyada tanıtımının yapılmasının amaçlandığını söyledi,0,OTHER
197c5456-836b-4c5f-acc8-9ee2cc879d3c,beceriksiz döktün yine,1,INSULT
7c00d103-5215-4f4e-ae68-eea044e223b3,kızsın doğru düzgün otur,1,SEXIST
c9f122a0-2c5d-40da-b14d-404293fa6b33,osman bey soyundan gelmeyen padişah olamaz,1,RACIST
55c49b36-286b-4239-8419-0a2a1b049cd1,lan git burdan,1,PROFANITY
405c2722-a8e3-43d9-a411-59b043f50bc5,evde oturan koca olur,1,SEXIST
b5d49bbc-4389-4d54-9aa1-3b2fe418caf5,orospu çocuğuna bak bize söylemeden neler yapmış,1,PROFANITY
f80c5571-b571-49ce-9b6d-ee4479e6f929,hal amcık,1,PROFANITY
feed9db4-48c5-4e91-88ec-640a2770b655,keseye kadın eli girerse bereket girer,1,SEXIST
321129f5-ce5a-4415-9196-86815b5c127b,mültecilerle aynı havayı solumak istemiyorum,1,RACIST
0b7dafa4-e3a3-4ded-a2f1-86a1a52114e9,duyduğun şeye inanma,0,OTHER
47b73e7e-a28c-405b-905a-d695e47cc7c8,çingene mahallesine taşınmışlar hepten çingene moduna girmiş,1,RACIST
f9816b54-ca63-42f2-ab61-4f82983ee8e6,seni aptal çocuk,1,INSULT
943f2b8f-98fa-4002-8140-58c5f9fcbeeb,sümüğü atmam sana,1,INSULT
241ccdd5-edfd-43d0-a7e7-6926648f4162,artık devlet politikasıdır,0,OTHER
07b09d4f-cde1-4f5b-833a-b74cab71c50b,kadınlar ağlaktır,1,SEXIST
32c7514a-6669-48cc-a17b-0f0dcd89524f,kadınlar olmasa erkekler hiçtir,1,SEXIST
8627bb90-e10c-469c-808d-597ae23d8b1b,pısırık sevgili istemem,1,INSULT
4ac14986-42f1-45f8-ba10-c50e9a0582a9,pezevengin karısı orospudur,1,PROFANITY
dbea14df-cb44-4ddf-8d1a-c2f8839f67c9,otelde evde kaldığı zamanlarda çamaşırını yıkardık,0,OTHER
22524654-15c3-470b-9af2-7fa7f9fb9750,haftada mi yüzünü yıkıyorsun,1,INSULT
9a301858-87e1-405b-a42c-f9adb4dff46a,arap baharı müslüman kardeşler açısından altın fırsat yarattı,0,OTHER
5b6f6f10-0c70-49c7-8beb-d163da71b970,suna bak okuze benziyor,1,INSULT
3aaa8690-90f2-402f-addd-3d58ed6cc19c,siklet beyinli,1,PROFANITY
50613371-7fb3-441a-ba59-794d95e11f60,onu eve alma türk,1,RACIST
4fc2506c-e96f-49e1-bbae-1fe7f17512f6,nedenle çıktı almadan formu kapatmayınız,0,OTHER
7517d5a4-7876-40c6-afb9-a389947ccfbe,çingeneler yapar pis insanlar işte,1,RACIST
4e240dc8-48a9-486b-a1ce-b340fecb95d3,sayede denizin dibinde dogal hayati yok ediyor,0,OTHER
c4a34a66-cc5b-495a-9be7-53c0287c1261,gayrimüslimlere çocuk emanet edemem,1,RACIST
766a4c94-b94f-4798-855e-6eeeaaa6fe04,kanal düzenlemesi silme yerleştirme fonksiyonları uydu blokları,0,OTHER
ed96c456-88a1-4103-9d20-834b695aa36a,sonra ağabeyimi kaybettik,0,OTHER
23d9da5a-723b-40fc-9b92-2d334b4ee80a,kendini bilmezin birisin,1,INSULT
7c28a6fe-c520-4f09-8e85-d7a4ca498e29,kadınlar kocalarının izni olmadan dışarı çıkamazlar,1,SEXIST
454a2a4e-a4de-4be9-866c-e74f127657a3,kirli çamaşır bile senden kirlidir,1,INSULT
707670f0-9fb1-4a33-853f-108990abb878,kocam isterse calisirim,1,SEXIST
32f4c0d7-fc97-4860-9340-765869015d9b,astrofizik doner kara delikler enerji buyuk miktarda potansiyel kaynagidir gama isini patlamalari enerjik fenomeni aciklamak icin kullanilir,0,OTHER
238c8046-8ead-4f67-8a5e-bf4cdbb0f457,kürtçe acıtasyonları yetmedi arapça basladı,1,RACIST
55d922c3-c3a7-4560-b2d2-c0cb77d79649,mahremin olan erkeğinin yanında istediğini giy,1,SEXIST
add5f36e-ecab-42d4-a69e-bf5f7988d076,ancak bizler ülkenin vatandaşıyız kadar farklı inançlarda olsak bile,0,OTHER
d40993fb-0bbb-4a62-ba6c-38844eb89ca4,armut kafalı kel sırık olduğunu farkettim,1,INSULT
b83dc500-f9e7-4adc-b1bb-a393ae1217f7,kız zırlama,1,SEXIST
bdeebcce-5575-4712-a693-e422132cd160,dağdan inme yörük erik bilirmiş koruk,1,RACIST
b5569448-2c2a-480b-a584-754a36037d20,aleviler pis kokar,1,RACIST
8dc7ab5a-505e-4db4-91c0-410e5e9e04fa,seni adi köpek,1,INSULT
95cc77cc-0244-4d0b-a438-70149fb3d2b9,neye küfür edeceğimi şaşırdım amına koyayım herşey küfürlük,1,PROFANITY
6737dc80-4989-4be7-a699-18fe1e19e8b7,kadınlar çiçektir narindirler,1,SEXIST
b3be8f2c-c2ed-4bde-b022-fec13b28559b,pis bitli çocuk,1,INSULT
969b4ba5-c1e6-4c08-b2c3-b747990f372e,çabaların çarpık iskeleti düzeltmek yerine makyaj tazelemeye yönelikti,0,OTHER
2fae0db4-37e7-4b48-b3db-d903028fab0a,am bulmuş kıllısını arıyor,1,PROFANITY
9b5766c5-2f04-4402-acaa-da2890508d02,vasat karı işide beceremez misin ,1,INSULT
3b893783-0fb5-44e1-8788-3d6553ee09b7,musevilik müslümanlığa göre serttir dine inanılmaz,1,RACIST
68c2d74b-4e4d-4bd2-bd12-f2ef89f507fb,serçe yaşlansa ormancı olur evlenmemiş hanım yaşlansa yalancı olur,1,SEXIST
aa9a758b-423c-4d73-b8b4-37e71afbc4f2,beş kız oğlanın yerini tutar mı,1,SEXIST
e2f94580-255c-4c0a-8da5-54397ef73a3b,hazırlık maçlarının ardından transfere ihtiyaç duyulması halinde gerekenin yapılması kararı çıktı toplantıdan,0,OTHER
f285bc8e-3bea-47c7-b0be-bd6c262f0ea0,suriyelilerin yaşamaya hakkı yok,1,RACIST
bf02dd70-ea19-4dd9-a6e1-37352c435c06,boş sözler kurarsın gerçekten anlamlı söyleyebilir misin,1,INSULT
46326d25-2b25-490b-b4fa-08f9bdb2682b,seçtiğiniz bilgisayarınız adresinize teslim edilsin,0,OTHER
8a48964b-7b99-4cac-8c81-e30a9bdf3ce3,manyak mısın evladım,1,PROFANITY
8ae7e339-76bc-46ad-a11c-4d61a4ea8deb,türkiyedeki suriyeliler almanyadaki türkler olucak,1,RACIST
faec1976-ac6f-4639-98d8-81ef4099e753,ağabeyimle görüşmek istediğimi anlattım,0,OTHER
d5a172a0-ad19-470b-b1fc-4d936e0e12b3,davar yeme,1,INSULT
5458e409-9d9d-49d6-8a3c-c15cd0eff09d,sus kız kısmısı karışmaz,1,SEXIST
f0929963-59eb-44e2-899c-8d9017ee9924,dindarlar gerici zihniyetleriyle çocukları ele geçirmeye çalışıyor,1,RACIST
f3dd28f4-e50f-4c23-ae21-53d04d542683,leş sarhoş olmuş gelmiş müslümanım diyorsun,1,INSULT
f833b3fb-bdd1-4abd-b155-134eed4b464b,başarısızlığını hastalığına bağladı,0,OTHER
4ab8dedd-68f0-4e5a-b790-d3820083f7a5,yaparsam öldürüleceğimi düşünüyorum,0,OTHER
0938b20a-7426-4b7a-a35b-c192dff9e4d9,kadın arabadan anlamaz,1,SEXIST
c397682f-ec58-4ff5-98fb-cdf6fda1693a,tesettür giymeyen kadın aranıyordur,1,SEXIST
06fd9c94-97d5-4ca8-a127-7a11879f707b,dort buyuk ailenin yerlesmesiyle meydana gelmis koydur,0,OTHER
a8145a40-04f3-4201-88d4-ffa1503f3257,önce işine bak çapsız,1,INSULT
c84a3466-22dc-47b8-a3c4-7c82bed2cc6e,paslanma yapmaz kimyasal olarak nötrdür,0,OTHER
c7e64fe6-daaa-4041-842e-687b04236b14,erkek dediğin aldatabilir,1,SEXIST
f934024f-87fa-4463-ba65-460aaff628e8,sayısal veri elde etmek kullanılır,0,OTHER
6f9d4175-f426-4408-b8b3-a1b06b0741ee,ağzına sıçtığımın orospusu,1,PROFANITY
0000c9e4-0651-4243-912d-cf59cc9dc839,burnu tam laz burnu,1,RACIST
370a499b-3f42-4b97-8e1c-374cf6d52e32,nedenle önemlidir,0,OTHER
280f0244-335a-465d-9b1c-086f0b07159f,baskalarinin sirtindan gecinen asalak biriydi,1,INSULT
d9bb184c-cabd-43bd-8d5a-1b86d5fe9959,arapa serbestçe vurabilirsin onlar serbestçe saldırabileceğin düşmanlardır,1,RACIST
d56ade94-94bb-4c81-867c-b509ae44f602,erkeklerin analitik düşünme yapısı kadınlardan iyidir yüzden matematiksel konularda erkeklerle görüşün,1,SEXIST
ad5ab03e-8dc6-47b9-a08c-9b2616a37e95,benim kürt arkadaşlarım var sandığınız kötü değiller,1,RACIST
88ad5d03-ac2a-4635-9a1b-5cfb4a1b3549,kültürlerini korumayan müslüman ülkeleri başlarına gelenleri kendi kimliklerinin coğrafyalardan silinmesini hak etmişlerdir,1,RACIST
740fed69-654b-42a1-83d5-25760953b24d,ben böyle kalabalık ağızlı insan önce görmemiştim haytımda,1,INSULT
0553d4f2-42d9-48ba-9fda-ef59c7d076e7,bıngıldağını siktiğim,1,PROFANITY
865efa6d-87b8-4d71-b4d9-b207294b412c,ayrılıp gitmesine müsaade etmiyorum,0,OTHER
97403a2e-fda2-4c27-a796-31804a84c523,oysa hücreler artık dolu,0,OTHER
a2c969fe-188b-49d6-b8b2-9cf57e3c0d24,kafanı götüne sokarım hayat akışını görürsün,1,PROFANITY
ac3dbb8b-ea67-43d8-b1ed-0c7728e2bd06,erkek dergilerine hafif porno sitelerine pozlar vermeye başlamıştır,0,OTHER
29b9f49f-4760-440d-8530-21222ecda991,herkes şeyi yapamaz,0,OTHER
aef11532-807b-4b79-9a2c-1bf652c51991,içe içe doydum ananın amına koydum,1,PROFANITY
7e8c9a9f-d39f-4a47-b0ce-c984dddc1ced,hırsıza loş zenciye folloş gerek,1,RACIST
53517a3e-d559-439a-9c0a-0eb13cc22945,kocasına patlıcanlı söğürtme yapan kadın dizlerini büküp yemeğini yedi,0,OTHER
03736e17-a823-4f94-a842-2ea33e404a43,yengesini siken orospu çocuğu,1,PROFANITY
c7744761-3de1-42d7-a918-5503863dde97,ayrıca politik askeri teknolojik baskı unsurudur,0,OTHER
2b4982cc-a990-4321-8174-50952c7a962c,yat aşağı dik taşağı,1,PROFANITY
bb833f54-71aa-470a-abd5-920339b84e6e,ülkenin huzuru kalmadı mülteciler gitmeli,1,RACIST
1164a531-36e2-4fea-9ad0-138a1c208864,sik gibi orda bekliyorsun,1,PROFANITY
